{
  "meeting_id": "MTG-CASE-05-03",
  "project_id": "PJT-CASE-05",
  "manager_id": "MGR-CASE-05",
  "dimension_findings": [
    {
      "dimension": "方向校准力",
      "finding_type": "observation",
      "summary": "管理者在应急会议中识别了供应链瓶颈风险，并做出了明确的决策方向，但缺乏对项目整体目标、范围和优先级影响的明确判断。",
      "evidence_refs": [
        {
          "source_type": "base_meeting",
          "source_file": "04_meetings/base_meetings_record_list.json",
          "source_id": "MTG-CASE-05-03",
          "timestamp": "2026-04-24 09:00 - 09:45",
          "excerpt": "协调供应链总监争取插队 | 同步评估供应商C打样能力 | 周牧单独跟进不占用群资源",
          "evidence_note": "会议决策摘要显示了对供应链风险的具体应对措施。"
        },
        {
          "source_type": "statement",
          "source_file": "04_meetings/base_statements_record_list.json",
          "source_id": "MTG-CASE-05-03-STM-2",
          "timestamp": "MTG-CASE-05-03",
          "excerpt": "先不在群里说了，我单独找供应链总监协调，看看能不能插队。",
          "evidence_note": "管理者明确了自己作为owner，并采取了具体的跟进动作。"
        },
        {
          "source_type": "hard_metric",
          "source_file": "hard_metrics_result",
          "source_id": "meeting_decision_coverage_rate",
          "timestamp": "2026-01-01 ~ 2026-04-24",
          "excerpt": "value = 1, calculation.expression = 3 / 3",
          "evidence_note": "metric_id=meeting_decision_coverage_rate, formula=value = meetings_with_decision_trace / total_meetings, calculation.expression=3 / 3, value=1"
        }
      ],
      "confidence": 0.7,
      "risk_tags": [
        "context_limited"
      ],
      "suggested_actions": [
        "在后续会议中，应明确阐述当前应急决策对项目核心目标（如开模周期压缩）和关键里程碑（如模具T0节点）的具体影响。"
      ]
    },
    {
      "dimension": "推进闭环力",
      "finding_type": "strength",
      "summary": "管理者在会议中形成了明确的决策和行动项，且历史数据显示任务定义完整、留痕覆盖良好，闭环流程的基础扎实。",
      "evidence_refs": [
        {
          "source_type": "hard_metric",
          "source_file": "hard_metrics_result",
          "source_id": "task_definition_completeness_rate",
          "timestamp": "2026-01-01 ~ 2026-04-24",
          "excerpt": "value = 1, calculation.expression = 30 / 30",
          "evidence_note": "metric_id=task_definition_completeness_rate, formula=value = tasks_with_task_name_owner_due_date / total_tasks, calculation.expression=30 / 30, value=1"
        },
        {
          "source_type": "hard_metric",
          "source_file": "hard_metrics_result",
          "source_id": "meeting_action_item_coverage_rate",
          "timestamp": "2026-01-01 ~ 2026-04-24",
          "excerpt": "value = 1, calculation.expression = 3 / 3",
          "evidence_note": "metric_id=meeting_action_item_coverage_rate, formula=value = meetings_with_action_item_count_gt_0 / total_meetings, calculation.expression=3 / 3, value=1"
        },
        {
          "source_type": "hard_metric",
          "source_file": "hard_metrics_result",
          "source_id": "closed_task_quality_rate",
          "timestamp": "2026-01-01 ~ 2026-04-24",
          "excerpt": "value = 1, calculation.expression = 13 / 13",
          "evidence_note": "metric_id=closed_task_quality_rate, formula=value = qualified_closed_tasks / closed_tasks, calculation.expression=13 / 13, value=1"
        }
      ],
      "confidence": 0.9,
      "risk_tags": [],
      "suggested_actions": []
    },
    {
      "dimension": "推进闭环力",
      "finding_type": "risk",
      "summary": "当前会议的行动项未完全转化为任务，且项目整体任务关闭率偏低，存在闭环断裂或任务积压的风险。",
      "evidence_refs": [
        {
          "source_type": "hard_metric",
          "source_file": "hard_metrics_result",
          "source_id": "current_meeting_action_task_rate",
          "timestamp": "2026-01-01 ~ 2026-04-24",
          "excerpt": "value = 0.6667, calculation.expression = 2 / 3, anomalies = 会议行动项 3 条，任务表命中 2 条",
          "evidence_note": "metric_id=current_meeting_action_task_rate, formula=value = min(tasks_linked_to_current_meeting, current_meeting_action_item_count) / current_meeting_action_item_count, calculation.expression=2 / 3, value=0.6667"
        },
        {
          "source_type": "hard_metric",
          "source_file": "hard_metrics_result",
          "source_id": "task_closure_rate",
          "timestamp": "2026-01-01 ~ 2026-04-24",
          "excerpt": "value = 0.4333, calculation.expression = 13 / 30",
          "evidence_note": "metric_id=task_closure_rate, formula=value = closed_tasks / total_tasks, calculation.expression=13 / 30, value=0.4333"
        },
        {
          "source_type": "current_meeting",
          "source_file": "meeting_fact_pack",
          "source_id": "MTG-CASE-05-03",
          "timestamp": "2026-04-24 09:00 - 09:45",
          "excerpt": "action_items: [\"供应商B打样评估\", \"声学团队散热孔位置确认\"]",
          "evidence_note": "当前会议记录的行动项列表。"
        }
      ],
      "confidence": 0.8,
      "risk_tags": [
        "action_tracking_gap",
        "backlog_accumulation"
      ],
      "suggested_actions": [
        "复核并补充缺失的会议行动项（如‘协调供应链总监争取插队’）到任务表中，明确owner和DDL。",
        "检查低关闭率原因，是任务定义过多、执行受阻，还是关闭流程未及时更新。"
      ]
    }
  ],
  "human_review_items": [
    {
      "review_id": "review_missing_current_transcript_01",
      "reason": "当前会议缺完整妙记转写，关键语义判断需人工确认上下文。",
      "severity": "medium",
      "related_dimension": "方向校准力",
      "evidence_refs": [
        {
          "source_type": "current_meeting",
          "source_file": "meeting_fact_pack",
          "source_id": "MTG-CASE-05-03",
          "timestamp": "2026-04-24 09:00 - 09:45",
          "excerpt": "missing_fields: [\"meeting_docs.current_transcript\"]",
          "evidence_note": "输入数据中明确标注当前会议缺少完整转写。"
        }
      ]
    },
    {
      "review_id": "review_action_task_mapping_01",
      "reason": "会议行动项 3 条，任务表命中 2 条",
      "severity": "medium",
      "related_dimension": "推进闭环力",
      "evidence_refs": [
        {
          "source_type": "hard_metric",
          "source_file": "hard_metrics_result",
          "source_id": "current_meeting_action_task_rate",
          "timestamp": "2026-01-01 ~ 2026-04-24",
          "excerpt": "anomalies: [\"会议行动项 3 条，任务表命中 2 条\"]",
          "evidence_note": "硬指标异常样本明确指出行动项与任务关联数量不一致。"
        },
        {
          "source_type": "current_meeting",
          "source_file": "meeting_fact_pack",
          "source_id": "MTG-CASE-05-03",
          "timestamp": "2026-04-24 09:00 - 09:45",
          "excerpt": "action_items: [\"供应商B打样评估\", \"声学团队散热孔位置确认\"]",
          "evidence_note": "当前会议记录的行动项列表。"
        },
        {
          "source_type": "base_task",
          "source_file": "03_task_risk_register/base_tasks_record_list.json",
          "source_id": "NO.508",
          "timestamp": "2026-04-20",
          "excerpt": "供应商B打样评估 source_meeting_id=MTG-CASE-05-03",
          "evidence_note": "任务表中关联到当前会议的任务示例。"
        }
      ]
    }
  ],
  "management_review_summary": "在方向校准力方面，管理者在应急会议中能识别风险并做出具体决策，但缺乏与项目整体目标关联的明确阐述。在推进闭环力方面，任务定义和留痕的基础良好，但存在当前会议行动项未完全转化为任务、以及项目整体任务关闭率偏低的显著风险，可能导致闭环断裂。需要人工复核会议完整语境和行动项跟踪的一致性。"
}